verse;English;Basque;gloss;marker;allomorph;case;role;noun-class;remarks_morph;remarks_sem;text;author;year;century;period;place;dialect;
(Mark 2,8);Why reason ye these things in your hearts?;Eta bertan ezaguturik Jesusek bere spirituaz, ezen hala zihardukatela berak baithan, erran ziezen, Zergatik horrelako gauzez dihardukazue zuen bihotzetan.;;gatik;;CAUS;Cause;interrogative;;;Gospel of Mark - Jesus Kristen Ebanjelio Saindua S. Marken Araura;Leizarraga;1571;16;Archaic Basque;Labourd;Labourdin;
(Mark 2,16);And when the scribes and Pharisees saw him eat with publicans and sinners, they said unto his disciples, How is it that he eateth and drinketh with publicans and sinners?;Eta Skribék eta Fariseuék ikhusirik publikanoekin eta jende bizitze gaixtotakoekin jaten zuela, erran ziezén haren diszipuluei, Zergatik publikanoekin eta bizitze gaixtotakoekin jaten du eta edaten?;;gatik;;CAUS;Cause;interrogative;;;Gospel of Mark - Jesus Kristen Ebanjelio Saindua S. Marken Araura;Leizarraga;1571;16;Archaic Basque;Labourd;Labourdin;
(Mark 2,18);Why do the disciples of John and of the Pharisees fast, but thy disciples fast not?;Eta Joanesen eta Fariseuén diszipuluék barur egiten zutén: eta hek ethorten dirade eta diotsate, Zergatik Joanesen eta Fariseuen diszipuluék barur egiten dute, eta hire diszipuluék ezpáitute barurik egiten?;;gatik;;CAUS;Cause;interrogative;;;Gospel of Mark - Jesus Kristen Ebanjelio Saindua S. Marken Araura;Leizarraga;1571;16;Archaic Basque;Labourd;Labourdin;
(Mark 2,24);Behold, why do they on the sabbath day that which is not lawful?;Eta Fariseuék erran ziezoten, Horrá, zergatik egiten duté Sabathoan egin sori eztena?;;gatik;;CAUS;Cause;interrogative;;;Gospel of Mark - Jesus Kristen Ebanjelio Saindua S. Marken Araura;Leizarraga;1571;16;Archaic Basque;Labourd;Labourdin;
(Mark 2,27);The sabbath was made for man, and not man for the sabbath:;Gero erran ziezén: Sabathoa gizonagatik egin izan da, ez gizona Sabathoagatik.;;gatik;;CAUS;Motive;person;;;Gospel of Mark - Jesus Kristen Ebanjelio Saindua S. Marken Araura;Leizarraga;1571;16;Archaic Basque;Labourd;Labourdin;
(Mark 2,27);The sabbath was made for man, and not man for the sabbath:;Gero erran ziezén: Sabathoa gizonagatik egin izan da, ez gizona Sabathoagatik.;;gatik;;CAUS;Motive;event;;;Gospel of Mark - Jesus Kristen Ebanjelio Saindua S. Marken Araura;Leizarraga;1571;16;Archaic Basque;Labourd;Labourdin;
(Mark 2,28);Therefore the Son of man is Lord also of the sabbath.;Bada gizonaren Semea Sabathoaren ere jabe da.;;NOT_APPLY;;;;;;;Gospel of Mark - Jesus Kristen Ebanjelio Saindua S. Marken Araura;Leizarraga;1571;16;Archaic Basque;Labourd;Labourdin;
(Mark 3,5);being grieved for the hardness of their hearts, he saith unto the man, ;Eta hetarát inguru behaturik aserrerekin, eta haien bihotzeko obstinazioneaz kontristaturik, diotsa gizonari: Heda ezak eure eskua. Eta heda zezan, eta haren eskua, berzea bezain senda zedin.;;z;;INS;Cause;abstract;;negative;Gospel of Mark - Jesus Kristen Ebanjelio Saindua S. Marken Araura;Leizarraga;1571;16;Archaic Basque;Labourd;Labourdin;
(Mark 3,6);And the Pharisees went forth, and straightway took counsel with the Herodians against him, how they might destroy him.;Orduan ilkhirik Fariseuék, bertan Herodianoekin konseillu eduki zezaten haren kontra, hura hil lezatenzat.;;ren_kontra;;postp;Maleficiary;pronoun;;;Gospel of Mark - Jesus Kristen Ebanjelio Saindua S. Marken Araura;Leizarraga;1571;16;Archaic Basque;Labourd;Labourdin;
(Mark 3,9);And he spake to his disciples, that a small ship should wait on him because of the multitude, lest they should throng him.;Eta erran ziezén bere diszipuluei unzixo bat bethi prest eduki lekión, jendetzearen kausaz, hers ez lezatenzát.;;ren_kausaz;;INS;Force;people;;negative;Gospel of Mark - Jesus Kristen Ebanjelio Saindua S. Marken Araura;Leizarraga;1571;16;Archaic Basque;Labourd;Labourdin;
(Mark 3,14);And he ordained twelve, that they should be with him, and that he might send them forth to preach,;Eta ordena zitzan hamabi harekin izateko, eta predikatzera igorteko;;ko;;REL;Purpose;nominalization;;;Gospel of Mark - Jesus Kristen Ebanjelio Saindua S. Marken Araura;Leizarraga;1571;16;Archaic Basque;Labourd;Labourdin;
(Mark 3,14);And he ordained twelve, that they should be with him, and that he might send them forth to preach,;Eta ordena zitzan hamabi harekin izateko, eta predikatzera igorteko;;ko;;REL;Purpose;nominalization;;;Gospel of Mark - Jesus Kristen Ebanjelio Saindua S. Marken Araura;Leizarraga;1571;16;Archaic Basque;Labourd;Labourdin;
(Mark 3,21);And when his friends heard of it, they went out to lay hold on him: for they said, He is beside himself.;Eta haur enzun zutenean haren ahaideak ilkhi zitezen hatzaman lezatenzat: ezen erraiten zuten, zoratu zela.;;NOT_APPLY;;;;;;;Gospel of Mark - Jesus Kristen Ebanjelio Saindua S. Marken Araura;Leizarraga;1571;16;Archaic Basque;Labourd;Labourdin;
(Mark 3,24);And if a kingdom be divided against itself, that kingdom cannot stand.;Ezen baldin resuma bat bere kontra partitua bada, ezin dauke resuma hura.;;ren_kontra;;postp;Maleficiary;pronoun;;;Gospel of Mark - Jesus Kristen Ebanjelio Saindua S. Marken Araura;Leizarraga;1571;16;Archaic Basque;Labourd;Labourdin;
(Mark 3,25);And if a house be divided against itself, that house cannot stand.;Eta baldin etxe bat bere kontra partitua bada, ezin dauke etxe hura.;;ren_kontra;;postp;Maleficiary;pronoun;;;Gospel of Mark - Jesus Kristen Ebanjelio Saindua S. Marken Araura;Leizarraga;1571;16;Archaic Basque;Labourd;Labourdin;
(Mark 3,26);And if Satan rise up against himself, and be divided, he cannot stand, but hath an end.;Hala baldin Satan ere altxa badadi eta partitua bada bere kontra, ezin dauke, baina fin du.;;ren_kontra;;postp;Maleficiary;spirit;;;Gospel of Mark - Jesus Kristen Ebanjelio Saindua S. Marken Araura;Leizarraga;1571;16;Archaic Basque;Labourd;Labourdin;
(Mark 3,27);"No man can enter into a strong man's house, and spoil his goods, except he will first bind the strong man; and then he will spoil his house.";Ezin nehork borthitz baten ostillamenduak, haren etxera sarthurik, pilla ahal ditzake, baldin lehen borthitza esteka ezpadeza: eta orduan haren etxea pillaturen du.;;NOT_APPLY;;;;;;;Gospel of Mark - Jesus Kristen Ebanjelio Saindua S. Marken Araura;Leizarraga;1571;16;Archaic Basque;Labourd;Labourdin;
(Mark 3,29);But he that shall blaspheme against the Holy Ghost hath never forgiveness, but is in danger of eternal damnation.;Baina nork ere blasfematuren baitu Spiritu sainduaren kontra eztu barkhamendurik ukhanen sekulan, baina izanen da kondemnazione eternalaren hogendun.;;ren_kontra;;postp;Maleficiary;spirit;;;Gospel of Mark - Jesus Kristen Ebanjelio Saindua S. Marken Araura;Leizarraga;1571;16;Archaic Basque;Labourd;Labourdin;
(Mark 3,29);But he that shall blaspheme against the Holy Ghost hath never forgiveness, but is in danger of eternal damnation.;Baina nork ere blasfematuren baitu Spiritu sainduaren kontra eztu barkhamendurik ukhanen sekulan, baina izanen da kondemnazione eternalaren hogendun.;;NOT_APPLY;;;;;;;Gospel of Mark - Jesus Kristen Ebanjelio Saindua S. Marken Araura;Leizarraga;1571;16;Archaic Basque;Labourd;Labourdin;
(Mark 4,8);"And other fell on good ground, and did yield fruit that sprang up and increased; and brought forth, some thirty, and some sixty, and some an hundred.";Eta berzea eror zedin lur onera, eta eman zezan fruktu goratzen eta handitzen zenik, eta ekhar zezan bihi batak hogei eta hamar, eta berzeak hirurogei, eta berzeak ehun.;;NOT_APPLY;;;;;;;Gospel of Mark - Jesus Kristen Ebanjelio Saindua S. Marken Araura;Leizarraga;1571;16;Archaic Basque;Labourd;Labourdin;
(Mark 4,17);And have no root in themselves, and so endure but for a time: afterward, when affliction or persecution ariseth for the word's sake, immediately they are offended.;Eta eztute errorik berak baithan, baina iraute gutitako dirade: gero heltzen denean tribulazionerik edo persekuzionerik hitzagatik, bertan skandalizatzen dirade.;;gatik;;CAUS;Cause;abstract;;negative;Gospel of Mark - Jesus Kristen Ebanjelio Saindua S. Marken Araura;Leizarraga;1571;16;Archaic Basque;Labourd;Labourdin;
(Mark 4,20);"And these are they which are sown on good ground; such as hear the word, and receive it, and bring forth fruit, some thirtyfold, some sixty, and some an hundred.";Eta hauk dirade lur onera hazia rezebitu dutenak, zeinék hitza enzuten baitute, eta rezebitzen, eta fruktu ekharten, batak hogei eta hamar, eta berzeak hirurogei, eta berzeak ehun.;;NOT_APPLY;;;;;;;Gospel of Mark - Jesus Kristen Ebanjelio Saindua S. Marken Araura;Leizarraga;1571;16;Archaic Basque;Labourd;Labourdin;
(Mark 4,40);And he said unto them, Why are ye so fearful? how is it that ye have no faith?;Eta erran ziezén: Zergatik zarete horrela izior? Nola eztuzue federik?;;gatik;;CAUS;Cause;interrogative;;;Gospel of Mark - Jesus Kristen Ebanjelio Saindua S. Marken Araura;Leizarraga;1571;16;Archaic Basque;Labourd;Labourdin;
(Mark 4,40);And he said unto them, Why are ye so fearful? how is it that ye have no faith?;Eta erran ziezén: Zergatik zarete horrela izior? Nola eztuzue federik?;;Ø;;;;;interrogative;;Gospel of Mark - Jesus Kristen Ebanjelio Saindua S. Marken Araura;Leizarraga;1571;16;Archaic Basque;Labourd;Labourdin;
(Mark 5,7);And cried with a loud voice, and said, What have I to do with thee, Jesus, thou Son of the most high God? I adjure thee by God, that thou torment me not.;Eta oihuz boz goraz erran zezan: Zer da hire eta ene artean, Jesus Jainko subiranoaren Semea? Adjuratzen aut Jainkoaren partez ez nezan tormenta.;;NOT_APPLY;;;;;;translation mistake: French prepostion PAR is confused with the noun PART;Gospel of Mark - Jesus Kristen Ebanjelio Saindua S. Marken Araura;Leizarraga;1571;16;Archaic Basque;Labourd;Labourdin;
(Mark 5,32);And he looked round about to see her that had done this thing.;Eta inguru behatzen zuen, haur egin zuena ikhus lezanzat.;;NOT_APPLY;;;;;;;Gospel of Mark - Jesus Kristen Ebanjelio Saindua S. Marken Araura;Leizarraga;1571;16;Archaic Basque;Labourd;Labourdin;
(Mark 5,33);But the woman fearing and trembling, knowing what was done in her, came and fell down before him, and told him all the truth.;Eta emaztea beldurrik eta ikhararik, nola baitzakian hura baithan egin izan zena, ethor zedin, eta egotz zezan bere burua haren aitzinera, eta erran ziezon egia guzia.;;NOT_APPLY;;;;;;;Gospel of Mark - Jesus Kristen Ebanjelio Saindua S. Marken Araura;Leizarraga;1571;16;Archaic Basque;Labourd;Labourdin;
(Mark 5,35);While he yet spake, there came from the ruler of the synagogue's house certain which said, Thy daughter is dead: why troublest thou the Master any further?;Oraino hura minzo zela ethor zitezen batzu sinagogako prinzipalarenetik, zioitela: Hire alabá hil duk, zergatik fatigatzen duk Majistrua?;;gatik;;CAUS;Motive;interrogative;;;Gospel of Mark - Jesus Kristen Ebanjelio Saindua S. Marken Araura;Leizarraga;1571;16;Archaic Basque;Labourd;Labourdin;
(Mark 5,39);And when he was come in, he saith unto them, Why make ye this ado, and weep? the damsel is not dead, but sleepeth.;Eta sarthurik dioste, Zergatik tormentatzen zarete, eta nigarrez zaudete? Neskatxá ezta hil, baina lo datza.;;gatik;;CAUS;Cause;interrogative;;;Gospel of Mark - Jesus Kristen Ebanjelio Saindua S. Marken Araura;Leizarraga;1571;16;Archaic Basque;Labourd;Labourdin;
(Mark 6,3);Is not this the carpenter, the son of Mary, the brother of James, and Joses, and of Juda, and Simon? and are not his sisters here with us? And they were offended at him.;Ezta haur xarpanter? Mariaren seme, Jakesen eta Josesen eta Judaren eta Simonen anaie? Eztirade hunen arrebak ere hemen gu baithan? Eta skandalizatzen ziraden hartan.;;NOT_APPLY;;;;;;;Gospel of Mark - Jesus Kristen Ebanjelio Saindua S. Marken Araura;Leizarraga;1571;16;Archaic Basque;Labourd;Labourdin;
(Mark 6,6);And he marvelled because of their unbelief.;Eta miraz zegoén haién inkredulitateagatik, eta inguratzen zituen burguak inguru, irakasten ari zela.;;gatik;;CAUS;Cause;abstract;;;Gospel of Mark - Jesus Kristen Ebanjelio Saindua S. Marken Araura;Leizarraga;1571;16;Archaic Basque;Labourd;Labourdin;
(Mark 6,8);"And commanded them that they should take nothing for their journey, save a staff only; no scrip, no bread, no money in their purse:";Eta mana zitzan ez lezaten deus har bidekotzat, makhila hutsa baizen: ez maletarik, ez ogirik, ez dirurik gerrikoan,;;kotz;kotzat;PURP;Purpose;event;;;Gospel of Mark - Jesus Kristen Ebanjelio Saindua S. Marken Araura;Leizarraga;1571;16;Archaic Basque;Labourd;Labourdin;
(Mark 6,11);And whosoever shall not receive you, nor hear you, when ye depart thence, shake off the dust under your feet for a testimony against them. ;Eta nork ere rezebituren ezpaitzaituzte, eta zuek ez enzunen, handik partitzean, iharros ezazue zuen oinén azpiko errhautsa, testimoniajetan haién kontra. ;;n;;INE;Quality;abstract;;;Gospel of Mark - Jesus Kristen Ebanjelio Saindua S. Marken Araura;Leizarraga;1571;16;Archaic Basque;Labourd;Labourdin;
(Mark 6,11);And whosoever shall not receive you, nor hear you, when ye depart thence, shake off the dust under your feet for a testimony against them. ;Eta nork ere rezebituren ezpaitzaituzte, eta zuek ez enzunen, handik partitzean, iharros ezazue zuen oinén azpiko errhautsa, testimoniajetan haién kontra. ;;ren_kontra;;postp;Maleficiary;pronoun;;;Gospel of Mark - Jesus Kristen Ebanjelio Saindua S. Marken Araura;Leizarraga;1571;16;Archaic Basque;Labourd;Labourdin;
(Mark 6,14);"And king Herod heard of him; (for his name was spread abroad:) and he said, That John the Baptist was risen from the dead, and therefore mighty works do shew forth themselves in him.";Eta enzun zezan rege Herodesek minzatzen (ezen haren izena zen famatua) eta erran zezan, Joanes batheiatzen ari zena, resuszitatu izan da hiletarik, eta halakotz berthuték obratzen duté hartan.;;kotz;;PURP;Cause;state_of_affairs;;;Gospel of Mark - Jesus Kristen Ebanjelio Saindua S. Marken Araura;Leizarraga;1571;16;Archaic Basque;Labourd;Labourdin;
(Mark 6,17);For Herod himself had sent forth and laid hold upon John, and bound him in prison for Herodias' sake, his brother Philip's wife: for he had married her.;Ezen Herodes hunek jende igorririk har zezan Joanes, eta esteka zezan presoindegian, Herodias bere anaie Filiperen emaztearen kausaz, zeren hura emazte hartu baitzuen.;;ren_kausaz;;CAUS;Cause;kinship;;negative;Gospel of Mark - Jesus Kristen Ebanjelio Saindua S. Marken Araura;Leizarraga;1571;16;Archaic Basque;Labourd;Labourdin;
(Mark 6,17);For Herod himself had sent forth and laid hold upon John, and bound him in prison for Herodias' sake, his brother Philip's wife: for he had married her.;Ezen Herodes hunek jende igorririk har zezan Joanes, eta esteka zezan presoindegian, Herodias bere anaie Filiperen emaztearen kausaz, zeren hura emazte hartu baitzuen.;;Ø;;ABS;Quality;kinship;;;Gospel of Mark - Jesus Kristen Ebanjelio Saindua S. Marken Araura;Leizarraga;1571;16;Archaic Basque;Labourd;Labourdin;
(Mark 6,19);"Therefore Herodias had a quarrel against him, and would have killed him; but she could not:";Halakotz Herodias aiher zaión, eta hil erazi nahi zuen, baina ezin zezakeen.;;ko;kotz;REL;Cause;state_of_affairs;connector;;Gospel of Mark - Jesus Kristen Ebanjelio Saindua S. Marken Araura;Leizarraga;1571;16;Archaic Basque;Labourd;Labourdin;
(Mark 6,26);"And the king was exceeding sorry; yet for his oath's sake, and for their sakes which sat with him, he would not reject her.";Eta Regek hagitz tristeturik, zinagatik eta harekin mahainean jarririk zeudenakgatik, eztu iraitzi nahi ukhan.;;gatik;;CAUS;Motive;abstract;;negative;Gospel of Mark - Jesus Kristen Ebanjelio Saindua S. Marken Araura;Leizarraga;1571;16;Archaic Basque;Labourd;Labourdin;
(Mark 6,26);"And the king was exceeding sorry; yet for his oath's sake, and for their sakes which sat with him, he would not reject her.";Eta Regek hagitz tristeturik, zinagatik eta harekin mahainean jarririk zeudenakgatik, eztu iraitzi nahi ukhan.;;gatik;;CAUS;Motive;relative;;negative;Gospel of Mark - Jesus Kristen Ebanjelio Saindua S. Marken Araura;Leizarraga;1571;16;Archaic Basque;Labourd;Labourdin;
(Mark 6,37);Shall we go and buy two hundred pennyworth of bread, and give them to eat?;Eta hark ihardesten zuela erran ziezén: Eiezue zuek jatera. Orduan diotsate: Ala joanik erosiren dugu berrehun dineroren ogia, eta emanen drauegu jatera?;;NOT_APPLY;;;;;;;Gospel of Mark - Jesus Kristen Ebanjelio Saindua S. Marken Araura;Leizarraga;1571;16;Archaic Basque;Labourd;Labourdin;
(Mark 7,5);Then the Pharisees and scribes asked him, Why walk not thy disciples according to the tradition of the elders, but eat bread with unwashen hands?;Gero interrogatzen dute Fariseuék eta Skribék: Zergatik hire diszipuluak eztabiltza aitzinekoen ordenanzén araura, baina eskuak ikhuzi gabe jaten dute ogia?;;gatik;;CAUS;Cause;interrogative;;;Gospel of Mark - Jesus Kristen Ebanjelio Saindua S. Marken Araura;Leizarraga;1571;16;Archaic Basque;Labourd;Labourdin;
(Mark 7,5);Then the Pharisees and scribes asked him, Why walk not thy disciples according to the tradition of the elders, but eat bread with unwashen hands?;Gero interrogatzen dute Fariseuék eta Skribék: Zergatik hire diszipuluak eztabiltza aitzinekoen ordenanzén araura, baina eskuak ikhuzi gabe jaten dute ogia?;;NOT_APPLY;;;;;;;Gospel of Mark - Jesus Kristen Ebanjelio Saindua S. Marken Araura;Leizarraga;1571;16;Archaic Basque;Labourd;Labourdin;
(Mark 7,7);Howbeit in vain do they worship me, teaching for doctrines the commandments of men.;Baina alferretan zerbitzatzen naute, irakasten dituztela doktrinatzat gizonén manamenduak.;enseignant POUR doctrine;tzat;;ESS;Quality;abstract;;;Gospel of Mark - Jesus Kristen Ebanjelio Saindua S. Marken Araura;Leizarraga;1571;16;Archaic Basque;Labourd;Labourdin;
(Mark 7,9);And he said unto them, Full well ye reject the commandment of God, that ye may keep your own tradition.;Erraiten zerauen halaber: Ungi nonbait iraizten duzue Jainkoaren manamendua, zuen ordenanzá begira dezazuenzát.;;NOT_APPLY;;;;;;;Gospel of Mark - Jesus Kristen Ebanjelio Saindua S. Marken Araura;Leizarraga;1571;16;Archaic Basque;Labourd;Labourdin;
(Mark 7,11);"But ye say, If a man shall say to his father or mother, It is Corban, that is to say, a gift, by whatsoever thou mightest be profited by me; he shall be free.";Baina zuek diozue: Baldin norbeitek aitari edo amari baderró, Eneganik izanen den korbana (erran nahi baita donoa) probetxaturen zaik, hogen gabe date hura.;;NOT_APPLY;;;;;;;Gospel of Mark - Jesus Kristen Ebanjelio Saindua S. Marken Araura;Leizarraga;1571;16;Archaic Basque;Labourd;Labourdin;
(Mark 7,13);Making the word of God of none effect through your tradition, which ye have delivered: and many such like things do ye.;Ezdeusten duzuela Jainkoaren hitza zeurok ordenatu duzuen ordenanzáz, eta hunelako berze gauzarik anhitz egiten duzue.;;z;;INS;Cause;abstract;;negative;Gospel of Mark - Jesus Kristen Ebanjelio Saindua S. Marken Araura;Leizarraga;1571;16;Archaic Basque;Labourd;Labourdin;
(Mark 7,29);"And he said unto her, For this saying go thy way; the devil is gone out of thy daughter.";Orduan erran ziezón: Hitz horrengatik ohá, ilkhi dun deabrua hire alabaganik.;;gatik;;CAUS;Cause;abstract;;;Gospel of Mark - Jesus Kristen Ebanjelio Saindua S. Marken Araura;Leizarraga;1571;16;Archaic Basque;Labourd;Labourdin;
(Mark 8,12);And he sighed deeply in his spirit, and saith, Why doth this generation seek after a sign? verily I say unto you, There shall no sign be given unto this generation.;Orduan barnadanik bere spirituan suspirio eginik, erran zezan: Zergatik jenerazione haur signo galdez dago? Egiaz diotsuet jenerazione huni signorik etzaiola emanen.;;gatik;;CAUS;Cause;interrogative;;;Gospel of Mark - Jesus Kristen Ebanjelio Saindua S. Marken Araura;Leizarraga;1571;16;Archaic Basque;Labourd;Labourdin;
(Mark 8,16);And they reasoned among themselves, saying, It is because we have no bread.;Eta bazihardukaten elkharren kontra, zioitela: Zeren ogirik eztugun da hori.;c'est pour ce que nous n'avons point de pains.;ren_kontra;;postp;Maleficiary;pronoun;;;Gospel of Mark - Jesus Kristen Ebanjelio Saindua S. Marken Araura;Leizarraga;1571;16;Archaic Basque;Labourd;Labourdin;
(Mark 8,16);And they reasoned among themselves, saying, It is because we have no bread.;Eta bazihardukaten elkharren kontra, zioitela: Zeren ogirik eztugun da hori.;c'est pour ce que nous n'avons point de pains.;ren;;GEN;Cause;connector;;;Gospel of Mark - Jesus Kristen Ebanjelio Saindua S. Marken Araura;Leizarraga;1571;16;Archaic Basque;Labourd;Labourdin;
(Mark 8,17);And when Jesus knew it, he saith unto them, Why reason ye, because ye have no bread? perceive ye not yet, neither understand? have ye your heart yet hardened?;Eta hori ezagutu zuenean Jesusek, erran ziezen: Zer dihardukazue, zeren ogirik eztuzuen? Oraino eztuzue konsideratzen ez aditzen? Oraino gogortua duzue zuen bihotza?;WHAT;Ø;;;Cause;interrogative;;;Gospel of Mark - Jesus Kristen Ebanjelio Saindua S. Marken Araura;Leizarraga;1571;16;Archaic Basque;Labourd;Labourdin;
(Mark 8,17);And when Jesus knew it, he saith unto them, Why reason ye, because ye have no bread? perceive ye not yet, neither understand? have ye your heart yet hardened?;Eta hori ezagutu zuenean Jesusek, erran ziezen: Zer dihardukazue, zeren ogirik eztuzuen? Oraino eztuzue konsideratzen ez aditzen? Oraino gogortua duzue zuen bihotza?;;NOT_APPLY;;;;;;;Gospel of Mark - Jesus Kristen Ebanjelio Saindua S. Marken Araura;Leizarraga;1571;16;Archaic Basque;Labourd;Labourdin;
(Mark 8,19);When I brake the five loaves among five thousand, how many baskets full of fragments took ye up? They say unto him, Twelve.;Borz ogiak hautsi nerauztenean borz milla gizonei zenbat saski zathiz beterik altxatu zentuzten? Diotsate: Hamabi.;;i;;DAT;Beneficiary;people;;;Gospel of Mark - Jesus Kristen Ebanjelio Saindua S. Marken Araura;Leizarraga;1571;16;Archaic Basque;Labourd;Labourdin;
(Mark 8,20);And when the seven among four thousand, how many baskets full of fragments took ye up? And they said, Seven.;Eta zazpiak laur milla gizonei hautsi nerauztenean zenbat saski zathiz betherik altxatu zentuzten? Eta hek erran ziezoten: Zazpi.;;i;;DAT;Beneficiary;people;;;Gospel of Mark - Jesus Kristen Ebanjelio Saindua S. Marken Araura;Leizarraga;1571;16;Archaic Basque;Labourd;Labourdin;
(Mark 8,35);"For whosoever will save his life shall lose it; but whosoever shall lose his life for my sake and the gospel's, the same shall save it.";"Ezen nork ere nahi ukhanen baitu bere bizia salbatu, galduren du hura; baina nork ere galduren baitu bere bizia enegatik eta Ebanjeliogatik, salbaturen du hura.";pour;gatik;;CAUS;Motive;pronoun;;;Gospel of Mark - Jesus Kristen Ebanjelio Saindua S. Marken Araura;Leizarraga;1571;16;Archaic Basque;Labourd;Labourdin;
(Mark 8,35);"For whosoever will save his life shall lose it; but whosoever shall lose his life for my sake and the gospel's, the same shall save it.";"Ezen nork ere nahi ukhanen baitu bere bizia salbatu, galduren du hura; baina nork ere galduren baitu bere bizia enegatik eta Ebanjeliogatik, salbaturen du hura.";pour;gatik;;CAUS;Motive;abstract;;;Gospel of Mark - Jesus Kristen Ebanjelio Saindua S. Marken Araura;Leizarraga;1571;16;Archaic Basque;Labourd;Labourdin;
(Mark 8,36);For what shall it profit a man, if he shall gain the whole world, and lose his own soul?;Ezen zer probetxu du gizonak, baldin mundu guzia irabaz badeza, eta bere arimá gal badeza?;;NOT_APPLY;;;;;;;Gospel of Mark - Jesus Kristen Ebanjelio Saindua S. Marken Araura;Leizarraga;1571;16;Archaic Basque;Labourd;Labourdin;
(Mark 8,38);"Whosoever therefore shall be ashamed of me and of my words in this adulterous and sinful generation; of him also shall the Son of man be ashamed, when he cometh in the glory of his Father with the holy angels.";Ezen nork ere ahalke izanen baita nizaz eta ene hitzéz jenerazione adultera eta bekhatore hunetan, gizonaren Semea ere ahalke izanen da harzaz, dathorrenean bere Aitaren glorian Aingeru sainduekin.;;z;;INS;Cause;pronoun;;negative;Gospel of Mark - Jesus Kristen Ebanjelio Saindua S. Marken Araura;Leizarraga;1571;16;Archaic Basque;Labourd;Labourdin;
(Mark 8,38);"Whosoever therefore shall be ashamed of me and of my words in this adulterous and sinful generation; of him also shall the Son of man be ashamed, when he cometh in the glory of his Father with the holy angels.";Ezen nork ere ahalke izanen baita nizaz eta ene hitzéz jenerazione adultera eta bekhatore hunetan, gizonaren Semea ere ahalke izanen da harzaz, dathorrenean bere Aitaren glorian Aingeru sainduekin.;;z;;INS;Cause;abstract;;negative;Gospel of Mark - Jesus Kristen Ebanjelio Saindua S. Marken Araura;Leizarraga;1571;16;Archaic Basque;Labourd;Labourdin;
(Mark 8,38);"Whosoever therefore shall be ashamed of me and of my words in this adulterous and sinful generation; of him also shall the Son of man be ashamed, when he cometh in the glory of his Father with the holy angels.";Ezen nork ere ahalke izanen baita nizaz eta ene hitzéz jenerazione adultera eta bekhatore hunetan, gizonaren Semea ere ahalke izanen da harzaz, dathorrenean bere Aitaren glorian Aingeru sainduekin.;;z;;INS;Cause;pronoun;;negative;Gospel of Mark - Jesus Kristen Ebanjelio Saindua S. Marken Araura;Leizarraga;1571;16;Archaic Basque;Labourd;Labourdin;
(Mark 9,5);"And Peter answered and said to Jesus, Master, it is good for us to be here: and let us make three tabernacles; one for thee, and one for Moses, and one for Elias.";"Orduan Pierrisek hitza harturik diotsa Jesusi: Majistruá, on duk gu hemen garén; egin ditzagun bada hirur tabernakle: bat hire, eta bat Moisesen, eta bat Eliasen.";un pour toy;ren;;GEN;Beneficiary;pronoun;;;Gospel of Mark - Jesus Kristen Ebanjelio Saindua S. Marken Araura;Leizarraga;1571;16;Archaic Basque;Labourd;Labourdin;
