verse;English;Basque;gloss;marker;allomorph;case;role;noun-class;remarks_morph;remarks_sem;text;author;year;century;period;place;dialect;
(Mark 12,19);Master, Moses wrote unto us, If a man's brother die, and leave his wife behind him, and leave no children, that his brother should take his wife, and raise up seed unto his brother.;Nausia, iskribuz utzi izan daroku Moisesek: Norbaiten anaia hiltzera heldu bada, eta uzten badu emaztea eta haurrik ez, hainaren anaiak har beza haren emaztea, eta ondore eman biozo bere anaiari.;;NOT_APPLY;;;;;;;Gospel of Mark - Jesu-Kristoren Ebanjelio Saindua Marken arabera;Duvoisin;1858;19;First Modern Basque;Labourd;Labourdin;
(Mark 12,19);Master, Moses wrote unto us, If a man's brother die, and leave his wife behind him, and leave no children, that his brother should take his wife, and raise up seed unto his brother.;Nausia, iskribuz utzi izan daroku Moisesek: Norbaiten anaia hiltzera heldu bada, eta uzten badu emaztea eta haurrik ez, hainaren anaiak har beza haren emaztea, eta ondore eman biozo bere anaiari.;;NOT_APPLY;;;;;;;Gospel of Mark - Jesu-Kristoren Ebanjelio Saindua Marken arabera;Duvoisin;1858;19;First Modern Basque;Labourd;Labourdin;
(Mark 12,35);And Jesus answered and said, while he taught in the temple, How say the scribes that Christ is the son of David?;Eta tenploan irakhasten hari zelarik, erran zuen Jesusek: <Noletan> diote Iskribauek, Kristo Dabiden semea dela?;;n;;INE;Cause;interrogative;;;Gospel of Mark - Jesu-Kristoren Ebanjelio Saindua Marken arabera;Duvoisin;1858;19;First Modern Basque;Labourd;Labourdin;
(Mark 12,40);Which devour widows' houses, and for a pretence make long prayers: these shall receive greater damnation.;"Zeinek, <othoitz luzeen aitzakian> iresten baitituzte alhargunen etxeak; hargatik hartuko dute juiamendu zorrotzagoa.";sous pretexte;ren_aitzakian;;CAUS;Motive;event;;false_reason;Gospel of Mark - Jesu-Kristoren Ebanjelio Saindua Marken arabera;Duvoisin;1858;19;First Modern Basque;Labourd;Labourdin;
(Mark 12,40);Which devour widows' houses, and for a pretence make long prayers: these shall receive greater damnation.;"Zeinek, othoitz luzeen aitzakian iresten baitituzte alhargunen etxeak; <hargatik> hartuko dute juiamendu zorrotzagoa.";;gatik;;CAUS;Cause;state_of_affairs;;;Gospel of Mark - Jesu-Kristoren Ebanjelio Saindua Marken arabera;Duvoisin;1858;19;First Modern Basque;Labourd;Labourdin;
(Mark 13,8);For nation shall rise against nation, and kingdom against kingdom: and there shall be earthquakes in divers places, and there shall be famines and troubles: these are the beginnings of sorrows.;"Ezen jauziko da populua populuaren kontra, erresuma erresumaren gainera; eta tokika izanen dire lur-ikharak eta goseteak. Horiek izanen dire minen hastapenak.";;ren;;GEN;Cause;connector;;;Gospel of Mark - Jesu-Kristoren Ebanjelio Saindua Marken arabera;Duvoisin;1858;19;First Modern Basque;Labourd;Labourdin;
(Mark 13,8);For nation shall rise against nation, and kingdom against kingdom: and there shall be earthquakes in divers places, and there shall be famines and troubles: these are the beginnings of sorrows.;"Ezen jauziko da populua <populuaren kontra>, erresuma erresumaren gainera; eta tokika izanen dire lur-ikharak eta goseteak. Horiek izanen dire minen hastapenak.";;ren_kontra;;postp;Maleficiary;people;;;Gospel of Mark - Jesu-Kristoren Ebanjelio Saindua Marken arabera;Duvoisin;1858;19;First Modern Basque;Labourd;Labourdin;
(Mark 13,8);For nation shall rise against nation, and kingdom against kingdom: and there shall be earthquakes in divers places, and there shall be famines and troubles: these are the beginnings of sorrows.;"Ezen jauziko da populua populuaren kontra, erresuma erresumaren gainera; eta tokika izanen dire lur-ikharak eta goseteak. Horiek izanen dire minen hastapenak.";;NOT_APPLY;;;;;;;Gospel of Mark - Jesu-Kristoren Ebanjelio Saindua Marken arabera;Duvoisin;1858;19;First Modern Basque;Labourd;Labourdin;
(Mark 13,9);"But take heed to yourselves: for they shall deliver you up to councils; and in the synagogues ye shall be beaten: and ye shall be brought before rulers and kings for my sake, for a testimony against them.";"Zuek ordean zuen buruen gainean zaudezte erne; ezen atheraturen zaituztete biltzarren aitzinera, eta zehatuak izanen zarete sinagogetan; buruzagien eta erregeen aitzinera agerturen zarete <ene ariaz> hekiei lekhukotasun egiteko.";;ren_ariaz;;CAUS;Cause;pronoun;;;Gospel of Mark - Jesu-Kristoren Ebanjelio Saindua Marken arabera;Duvoisin;1858;19;First Modern Basque;Labourd;Labourdin;
(Mark 13,9);"But take heed to yourselves: for they shall deliver you up to councils; and in the synagogues ye shall be beaten: and ye shall be brought before rulers and kings for my sake, for a testimony against them.";"Zuek ordean zuen buruen gainean zaudezte erne; ezen atheraturen zaituztete biltzarren aitzinera, eta zehatuak izanen zarete sinagogetan; buruzagien eta erregeen aitzinera agerturen zarete ene ariaz <hekiei lekhukotasun egiteko>.";;ko;;REL;Purpose;nominalization;;;Gospel of Mark - Jesu-Kristoren Ebanjelio Saindua Marken arabera;Duvoisin;1858;19;First Modern Basque;Labourd;Labourdin;
(Mark 13,10);And the gospel must first be published among all nations.;Eta lehenik Ebanjelioak behar du jendaki orotan izan erantzuna.;;NOT_APPLY;;;;;;;Gospel of Mark - Jesu-Kristoren Ebanjelio Saindua Marken arabera;Duvoisin;1858;19;First Modern Basque;Labourd;Labourdin;
(Mark 13,12);"Now the brother shall betray the brother to death, and the father the son; and children shall rise up against their parents, and shall cause them to be put to death.";"Orduan berriz, heriotzeari emanen dio anaiak anaia, eta aitak semea; eta haurrak jauziko dire burhasoen gainera, eta heriotzez joko dituzte.";;NOT_APPLY;;;;;;;Gospel of Mark - Jesu-Kristoren Ebanjelio Saindua Marken arabera;Duvoisin;1858;19;First Modern Basque;Labourd;Labourdin;
(Mark 13,13);And ye shall be hated of all men for my name's sake: but he that shall endure unto the end, the same shall be saved.;Eta guziei gaitzirizkotan izanen zarete <ene izenaren ariaz>. Bainan bururaino ihardukiren duena, hura izanen da salbatua.;;ren_ariaz;;CAUS;Cause;abstract;;;Gospel of Mark - Jesu-Kristoren Ebanjelio Saindua Marken arabera;Duvoisin;1858;19;First Modern Basque;Labourd;Labourdin;
(Mark 13,15);And let him that is on the housetop not go down into the house, neither enter therein, to take any thing out of his house:;"Eta hegaztegi gainean dena ez bedi jauts etxera, ez-eta barnera sar bere etxetik <zerbaiten hartzeko>;";;ko;;REL;Purpose;nominalization;;;Gospel of Mark - Jesu-Kristoren Ebanjelio Saindua Marken arabera;Duvoisin;1858;19;First Modern Basque;Labourd;Labourdin;
(Mark 13,16);And let him that is in the field not turn back again for to take up his garment.;Eta landetan izanen dena ez bedi gibelerat itzul <bere soinekoaren bilha>.;;ren_bila;;postp;Purpose;clothes;;;Gospel of Mark - Jesu-Kristoren Ebanjelio Saindua Marken arabera;Duvoisin;1858;19;First Modern Basque;Labourd;Labourdin;
(Mark 13,19);For in those days shall be affliction, such as was not from the beginning of the creation which God created unto this time, neither shall be.;<Ezen> egun hekietan izanen dire hanbateko hesturak, nolakorik Jainkoak egin munduaren hastapenetik hunat ez baita izan, ez izanen.;;ren;;GEN;Cause;connector;;;Gospel of Mark - Jesu-Kristoren Ebanjelio Saindua Marken arabera;Duvoisin;1858;19;First Modern Basque;Labourd;Labourdin;
(Mark 13,20);And except that the Lord had shortened those days, no flesh should be saved: but for the elect's sake, whom he hath chosen, he hath shortened the days.;"Eta Jaunak laburtu ez balitu egunak, gizon bat etzitakeen salbaturik; bainan egun hekiek laburtu ditu, <hautatu dituen hautetsien ariaz>.";;ren_ariaz;;CAUS;Motive;people;;;Gospel of Mark - Jesu-Kristoren Ebanjelio Saindua Marken arabera;Duvoisin;1858;19;First Modern Basque;Labourd;Labourdin;
(Mark 13,22);For false Christs and false prophets shall rise, and shall shew signs and wonders, to seduce, if it were possible, even the elect.;Ezen jaikiko dire kristo-aizunak eta profeta-aizunak, zeinek eginen baitituzte sendagailak eta gauza harrigarriak, <enganatzeko>, ahal balitz, hautetsiak berak ere.;;ko;;REL;Purpose;nominalization;;;Gospel of Mark - Jesu-Kristoren Ebanjelio Saindua Marken arabera;Duvoisin;1858;19;First Modern Basque;Labourd;Labourdin;
(Mark 13,35);Watch ye therefore: for ye know not when the master of the house cometh, at even, or at midnight, or at the cockcrowing, or in the morning:;"Zaudezte <beraz> atzarririk (ez dakizue ezen noiz ethorriren den etxeko jauna, arratsean, ala gauaren erdian, ala oilaritean, ala goizean);";;z;;INS;Cause;connector;;;Gospel of Mark - Jesu-Kristoren Ebanjelio Saindua Marken arabera;Duvoisin;1858;19;First Modern Basque;Labourd;Labourdin;
(Mark 14,1);After two days was the feast of the passover, and of unleavened bread: and the chief priests and the scribes sought how they might take him by craft, and put him to death.;"Bada, bi egunen buruan ziren Bazko eta Airisak; eta aphez nausiak eta Iskribauak bilha zabiltzan hean zer amarruz atzemanen eta hilaraziko zuten Jesus.";;NOT_APPLY;;;;;;;Gospel of Mark - Jesu-Kristoren Ebanjelio Saindua Marken arabera;Duvoisin;1858;19;First Modern Basque;Labourd;Labourdin;
(Mark 14,4);And there were some that had indignation within themselves, and said, Why was this waste of the ointment made?;Baziren bada, hori beren baithan gaizki khausitu zutenak, eta zerratenak: <Zertako> gal horrela gantzugailu hori?;;ko;;REL;Motive;interrogative;;;Gospel of Mark - Jesu-Kristoren Ebanjelio Saindua Marken arabera;Duvoisin;1858;19;First Modern Basque;Labourd;Labourdin;
(Mark 14,5);For it might have been sold for more than three hundred pence, and have been given to the poor. And they murmured against her.;Ezen hori, hirur ehun denario baino gehiagotan sal zitakeen eta beharrei eman. Eta <emaztekiarentzat> erasian hari ziren.;;rentzat;;BEN;Motive;person;;;Gospel of Mark - Jesu-Kristoren Ebanjelio Saindua Marken arabera;Duvoisin;1858;19;First Modern Basque;Labourd;Labourdin;
(Mark 14,6);"And Jesus said, Let her alone; why trouble ye her? she hath wrought a good work on me.";"Bainan Jesusek erran zioten: Utzazue; <zergatik> egiten diozue damurik? Niri hunek egina, ongi egina da.";;gatik;;CAUS;Motive;interrogative;;;Gospel of Mark - Jesu-Kristoren Ebanjelio Saindua Marken arabera;Duvoisin;1858;19;First Modern Basque;Labourd;Labourdin;
(Mark 14,6);"And Jesus said, Let her alone; why trouble ye her? she hath wrought a good work on me.";"Bainan Jesusek erran zioten: Utzazue; zergatik egiten diozue damurik? Niri hunek egina, ongi egina da.";envers moy;NOT_APPLY;;;;;;;Gospel of Mark - Jesu-Kristoren Ebanjelio Saindua Marken arabera;Duvoisin;1858;19;First Modern Basque;Labourd;Labourdin;
(Mark 14,7);For ye have the poor with you always, and whensoever ye will ye may do them good: but me ye have not always.;"Ezen zuekin baditutzue bethi beharrak, eta ongia egiten ahal diozuete, nahi dukezuenean; ni ordean ez nauzue izanen bethi.";;NOT_APPLY;;;;;;;Gospel of Mark - Jesu-Kristoren Ebanjelio Saindua Marken arabera;Duvoisin;1858;19;First Modern Basque;Labourd;Labourdin;
(Mark 14,10);And Judas Iscariot, one of the twelve, went unto the chief priests, to betray him unto them.;Orduan Judas Iskariot, hamabietarik bat, aphez nausietara goan zen, <hekiei saltzeko Jesus>.;;ko;;REL;Purpose;nominalization;;;Gospel of Mark - Jesu-Kristoren Ebanjelio Saindua Marken arabera;Duvoisin;1858;19;First Modern Basque;Labourd;Labourdin;
(Mark 14,12);And the first day of unleavened bread, when they killed the passover, his disciples said unto him, Where wilt thou that we go and prepare that thou mayest eat the passover?;Eta airisetako lehen egunean, zeintan imolatzen baitzen Bazko bildotsa, dizipuluek erraten diote Jesusi: Norat nahi duzu goan gaitezen behar denaren zuri aphaintzera, jan dezazun Bazkoa?;;NOT_APPLY;;;;;;;Gospel of Mark - Jesu-Kristoren Ebanjelio Saindua Marken arabera;Duvoisin;1858;19;First Modern Basque;Labourd;Labourdin;
(Mark 14,24);And he said unto them, This is my blood of the new testament, which is shed for many.;Eta Jesusek erran zioten: Hau da batasun berriko ene odola, <hainitzentzat> ixuriko dena.;;rentzat;;BEN;Motive;pronoun;;;Gospel of Mark - Jesu-Kristoren Ebanjelio Saindua Marken arabera;Duvoisin;1858;19;First Modern Basque;Labourd;Labourdin;
(Mark 14,27);And Jesus saith unto them, All ye shall be offended because of me this night: for it is written, I will smite the shepherd, and the sheep shall be scattered.;"Eta Jesusek erran zioten: Gau huntan guziek <ene ariaz> izanen duzue gaizbide; ezen iskribatua da: Joko dut artzaina, eta barraiatuko dire ardiak.";;ren_ariaz;;CAUS;Cause;pronoun;;;Gospel of Mark - Jesu-Kristoren Ebanjelio Saindua Marken arabera;Duvoisin;1858;19;First Modern Basque;Labourd;Labourdin;
(Mark 14,29);But Peter said unto him, Although all shall be offended, yet will not I.;Bada Piarresek erran zioen: Bertze guziak behaztopa baleitez ere <zure ariaz>, ni ez bederen.;;ren_ariaz;;CAUS;Cause;pronoun;;;Gospel of Mark - Jesu-Kristoren Ebanjelio Saindua Marken arabera;Duvoisin;1858;19;First Modern Basque;Labourd;Labourdin;
(Mark 14,36);"And he said, Abba, Father, all things are possible unto thee; take away this cup from me: nevertheless not what I will, but what thou wilt.";"Eta erran zuen: Abba aita, ez da <zuretzat> ezinik; urrun zazu kalitza hau ene ganik; bainan ez bedi egin ene nahia, bai ordean zurea.";toutes choses te sont posibles;rentzat;;BEN;Beneficiary;pronoun;;;Gospel of Mark - Jesu-Kristoren Ebanjelio Saindua Marken arabera;Duvoisin;1858;19;First Modern Basque;Labourd;Labourdin;
(Mark 14,38);Watch ye and pray, lest ye enter into temptation. The spirit truly is ready, but the flesh is weak.;"Zaudezte erne eta othoitz egizue, sar etzaitezten lerrabidetan; ezen izpiritua gurbil da, bainan haragia erorkor.";;NOT_APPLY;;;;;;;Gospel of Mark - Jesu-Kristoren Ebanjelio Saindua Marken arabera;Duvoisin;1858;19;First Modern Basque;Labourd;Labourdin;
(Mark 14,48);And Jesus answered and said unto them, Are ye come out, as against a thief, with swords and with staves to take me?;Eta Jesus mintzatu zitzaioten, erraten ziotelarik: Ohoin baten gana bezala ezpatekin eta makhilekin ilkhi zarete ene hartzera.;;NOT_APPLY;;;;;;;Gospel of Mark - Jesu-Kristoren Ebanjelio Saindua Marken arabera;Duvoisin;1858;19;First Modern Basque;Labourd;Labourdin;
(Mark 14,48);And Jesus answered and said unto them, Are ye come out, as against a thief, with swords and with staves to take me?;Eta Jesus mintzatu zitzaioten, erraten ziotelarik: Ohoin baten gana bezala ezpatekin eta makhilekin ilkhi zarete <ene hartzera>.;;ra;;ALL;Purpose;nominalization;;;Gospel of Mark - Jesu-Kristoren Ebanjelio Saindua Marken arabera;Duvoisin;1858;19;First Modern Basque;Labourd;Labourdin;
(Mark 14,55);"And the chief priests and all the council sought for witness against Jesus to put him to death; and found none.";Bizkitartean aphez nausiak eta batzarre guzia <Jesusen kontra> lekhukotasunketa zabiltzan, hura hilarazi beharrez, eta etzuten aurkhitzen.;;ren_kontra;;postp;Maleficiary;person;;;Gospel of Mark - Jesu-Kristoren Ebanjelio Saindua Marken arabera;Duvoisin;1858;19;First Modern Basque;Labourd;Labourdin;
(Mark 14,55);"And the chief priests and all the council sought for witness against Jesus to put him to death; and found none.";Bizkitartean aphez nausiak eta batzarre guzia Jesusen kontra lekhukotasunketa zabiltzan, <hura hilarazi beharrez>, eta etzuten aurkhitzen.;;beharrez;;CAUS;Purpose;nominalization;;;Gospel of Mark - Jesu-Kristoren Ebanjelio Saindua Marken arabera;Duvoisin;1858;19;First Modern Basque;Labourd;Labourdin;
(Mark 14,56);For many bare false witness against him, but their witness agreed not together.;"Ezen hainitzek gezurrezko lekhukotasunak atheratzen zituzten <haren kontra>; bainan lekhukotasunak etziren hitz-batekoak.";;ren_kontra;;postp;Maleficiary;pronoun;;;Gospel of Mark - Jesu-Kristoren Ebanjelio Saindua Marken arabera;Duvoisin;1858;19;First Modern Basque;Labourd;Labourdin;
(Mark 14,57);And there arose certain, and bare false witness against him, saying,;Azkenean, zenbaitek, jaikirik ekharri zuten gezurrezko lekhukotasun bat, ziotelarik:;;NOT_APPLY;;;;;;;Gospel of Mark - Jesu-Kristoren Ebanjelio Saindua Marken arabera;Duvoisin;1858;19;First Modern Basque;Labourd;Labourdin;
(Mark 14,60);And the high priest stood up in the midst, and asked Jesus, saying, Answerest thou nothing? what is it which these witness against thee?;Orduan, biltzarraren erdian xutiturik, aphez handiak erran zioen Jesusi: Ez duzu deusere ihardesten haukiek <zure kontra> atheratzen dituzten lekhukotasunei?;;ren_kontra;;postp;Maleficiary;pronoun;;;Gospel of Mark - Jesu-Kristoren Ebanjelio Saindua Marken arabera;Duvoisin;1858;19;First Modern Basque;Labourd;Labourdin;
(Mark 15,3);And the chief priests accused him of many things: but he answered nothing.;Eta aphez nausiek <asko gauzaz> hobendun egiten zuten.;;z;;INS;Cause;abstract;;;Gospel of Mark - Jesu-Kristoren Ebanjelio Saindua Marken arabera;Duvoisin;1858;19;First Modern Basque;Labourd;Labourdin;
(Mark 15,4);And Pilate asked him again, saying, Answerest thou nothing? behold how many things they witness against thee.;Eta Pilatok berriz galdatuz, erran zioen: Ez duzu deus ihardesten? Ikhusazu zenbat gaizki jazartzen darozkitzuten.;;NOT_APPLY;;;;;;;Gospel of Mark - Jesu-Kristoren Ebanjelio Saindua Marken arabera;Duvoisin;1858;19;First Modern Basque;Labourd;Labourdin;
(Mark 15,10);For he knew that the chief priests had delivered him for envy.;Bazakien alabainan aphez nausiek <bekhaizgoz> ezarri ziotela hura eskuetan.;;z;;INS;Force;emotion;;;Gospel of Mark - Jesu-Kristoren Ebanjelio Saindua Marken arabera;Duvoisin;1858;19;First Modern Basque;Labourd;Labourdin;
(Mark 15,15);And so Pilate, willing to content the people, released Barabbas unto them, and delivered Jesus, when he had scourged him, to be crucified.;"Azkenean Pilatok, <populuari atsegin egin beharrez>, utzi zioen Barrabas; eta Jesus, ordukoz azotatua, eman zioten gurutzefikatua izateko.";;beharrez;;CAUS;Purpose;nominalization;;;Gospel of Mark - Jesu-Kristoren Ebanjelio Saindua Marken arabera;Duvoisin;1858;19;First Modern Basque;Labourd;Labourdin;
(Mark 15,20);And when they had mocked him, they took off the purple from him, and put his own clothes on him, and led him out to crucify him.;Eta burlatu zuten ondoan, khendu zioten purpura, jauntzi ziozkaten bere soinekoak, eta <gurutzefikatzera> eraman zuten.;;ra;rat;ALL;Purpose;nominalization;;;Gospel of Mark - Jesu-Kristoren Ebanjelio Saindua Marken arabera;Duvoisin;1858;19;First Modern Basque;Labourd;Labourdin;
(Mark 15,24);And when they had crucified him, they parted his garments, casting lots upon them, what every man should take.;Eta gurutzefikatu zutenean, haren soinekoak berezi zituzten, zorthea arthikiz, nork zer eraman.;;NOT_APPLY;;;;;;;Gospel of Mark - Jesu-Kristoren Ebanjelio Saindua Marken arabera;Duvoisin;1858;19;First Modern Basque;Labourd;Labourdin;
(Mark 15,34);And at the ninth hour Jesus cried with a loud voice, saying, Eloi, Eloi, lama sabachthani? which is, being interpreted, My God, my God, why hast thou forsaken me?;Eta bederatzigarren orenean, Jesusek oihu handi batekin erran zuen: Eloi, Eloi, lamma sabaxthani? erran nahi baita: Ene Jainkoa, ene Jainkoa, >zeren> nauzu utzi?;;ren;;GEN;Cause;interrogative;;;Gospel of Mark - Jesu-Kristoren Ebanjelio Saindua Marken arabera;Duvoisin;1858;19;First Modern Basque;Labourd;Labourdin;
(Mark 16,1);And when the sabbath was past, Mary Magdalene, and Mary the mother of James, and Salome, had bought sweet spices, that they might come and anoint him.;Eta larunbata iragan zenean Maria Magdalenak, eta Maria Jakoberenak, eta Salomek baltsamuak erosi zituzten, <Jesusen gantzutzera goateko>.;;ko;;REL;Purpose;nominalization;;;Gospel of Mark - Jesu-Kristoren Ebanjelio Saindua Marken arabera;Duvoisin;1858;19;First Modern Basque;Labourd;Labourdin;
(Mark 16,14);Afterward he appeared unto the eleven as they sat at meat, and upbraided them with their unbelief and hardness of heart, because they believed not them which had seen him after he was risen.;"Azkenik agertu zitzaioten hamekei, mahainean zirelarik; eta gaizkiak erran ziozkaten <beren sinhesgaiztasunaz> eta bihotz gogortasunaz, zeren biztua zela ikhusi zutenei etzioten sinhesterik eman.";;z;;INS;Cause;abstract;;English gives WITH;Gospel of Mark - Jesu-Kristoren Ebanjelio Saindua Marken arabera;Duvoisin;1858;19;First Modern Basque;Labourd;Labourdin;
(Mark 16,14);Afterward he appeared unto the eleven as they sat at meat, and upbraided them with their unbelief and hardness of heart, because they believed not them which had seen him after he was risen.;"Azkenik agertu zitzaioten hamekei, mahainean zirelarik; eta gaizkiak erran ziozkaten beren sinhesgaiztasunaz eta <bihotz gogortasunaz>, zeren biztua zela ikhusi zutenei etzioten sinhesterik eman.";;z;;INS;Cause;abstract;;English gives WITH;Gospel of Mark - Jesu-Kristoren Ebanjelio Saindua Marken arabera;Duvoisin;1858;19;First Modern Basque;Labourd;Labourdin;
(Mark 1,4);John did baptize in the wilderness, and preach the baptism of repentance for the remission of sins.;Joan zegoan eremuan bataiatzen ari zala, eta penitenziako bataioa predikatzen zuela <bekatuen barkaziorako>.;;rako;;DEST;Purpose;abstract;;;Gospel of Mark - San Markosen Ebanjelioa;Uriarte;1858;19;First Modern Basque;Guipuscoa;Guipuscoan;
(Mark 1,15);And saying, The time is fulfilled, and the kingdom of God is at hand: repent ye, and believe the gospel.;Eta esaten zuela: Kunplitu da onezkero denbora, eta Jaungoikoaren erreñua alderatu da, <argatik> penitenzia egin ezazute, eta Ebanjelioari sinistu zaiozute.;;gatik;;CAUS;Cause;state_of_affairs;connector;;Gospel of Mark - San Markosen Ebanjelioa;Uriarte;1858;19;First Modern Basque;Guipuscoa;Guipuscoan;
(Mark 1,38);And he said unto them, Let us go into the next towns, that I may preach there also: for therefore came I forth.;Eta esan zien: Aldeko ballera eta errietara goazen, nik ere aietan predikatu dezadan, zeren <onetarako> etorri naizan.;;rako;;DEST;Purpose;state_of_affairs;;;Gospel of Mark - San Markosen Ebanjelioa;Uriarte;1858;19;First Modern Basque;Guipuscoa;Guipuscoan;
(Mark 2,4);And when they could not come nigh unto him for the press, they uncovered the roof where he was: and when they had broken it up, they let down the bed wherein the sick of the palsy lay.;Eta nola ezin jarri zuten Jesusen aurrean, inguruan zegoan <jendetzagatik>, idiki zuten tellatua Jesus zegoan aldamenetik, eta zulotik beera jetxi zuten, elbarridun gizona zetzan oetxoa.;;gatik;;CAUS;Force;people;;;Gospel of Mark - San Markosen Ebanjelioa;Uriarte;1858;19;First Modern Basque;Guipuscoa;Guipuscoan;
(Mark 2,7);Why doth this man thus speak blasphemies? who can forgive sins but God only? ;Zer da onek esaten duena? Blasfematzen du. Nork, Jaungoikoak bakarrik baizik, bekatuak barkatu ditzake?;;NOT_APPLY;;;;;;;Gospel of Mark - San Markosen Ebanjelioa;Uriarte;1858;19;First Modern Basque;Guipuscoa;Guipuscoan;
(Mark 2,8);Why reason ye these things in your hearts?;Eta Jesusek, au bereala ezaguturik bere espirituarekin, onelako gogorazioak zerabiltzatela beren artean, esaten die: <Zergatik> darabiltzkizute zuen biotzetan onelako gogorazioak?;;gatik;;CAUS;Cause;interrogative;;;Gospel of Mark - San Markosen Ebanjelioa;Uriarte;1858;19;First Modern Basque;Guipuscoa;Guipuscoan;
(Mark 2,16);And when the scribes and Pharisees saw him eat with publicans and sinners, they said unto his disciples, How is it that he eateth and drinketh with publicans and sinners?;Eta Eskribak eta Fariseoak ikusirik publikano eta bekatariakin jaten zuela, bere ikasleai esaten zien: <Zergatik> zuen Maisuak publikano eta bekatariakin jaten eta edaten du?;Pourquoi;gatik;;REL;Cause;interrogative;;;Gospel of Mark - San Markosen Ebanjelioa;Uriarte;1858;19;First Modern Basque;Guipuscoa;Guipuscoan;
(Mark 2,18);Why do the disciples of John and of the Pharisees fast, but thy disciples fast not?;"Eta Joanen ikasleak, eta Fariseoak barau egiten zaleak ziraden; eta etorri ziraden, eta esaten diote: <Zergatik> Joanen ikasleak, eta Fariseoak barauak egiten dituzte; zure ikasleak berriz, ez dute baraurik egiten?";;gatik;;CAUS;Cause;interrogative;;;Gospel of Mark - San Markosen Ebanjelioa;Uriarte;1858;19;First Modern Basque;Guipuscoa;Guipuscoan;
(Mark 2,22);And no man putteth new wine into old bottles: else the new wine doth burst the bottles, and the wine is spilled, and the bottles will be marred: but new wine must be put into new bottles.;Eta iñork ez du ipintzen ardo berria zagi zarretan, bestela ardoak zagiak urratuko ditu, eta ardoa isuriko da, eta zagiak galduko dirade. <Argatik> ardo berria zagi berrietan ipiñi bear da.;;;;CAUS;Cause;state_of_affairs;connector;;Gospel of Mark - San Markosen Ebanjelioa;Uriarte;1858;19;First Modern Basque;Guipuscoa;Guipuscoan;
(Mark 2,24);Behold, why do they on the sabbath day that which is not lawful?;Eta Fariseoak esaten zioten: <Nola> zure ikasleak larunbatean zillegi ez dana egiten dute?;;Ø;;;Cause;interrogative;;;Gospel of Mark - San Markosen Ebanjelioa;Uriarte;1858;19;First Modern Basque;Guipuscoa;Guipuscoan;
(Mark 2,27);The sabbath was made for man, and not man for the sabbath:;Eta gañera esan zien: Larunbata <gizonarentzat> egin zan, eta ez gizona larunbatarentzat.;;rentzat;;BEN;Beneficiary;person;;;Gospel of Mark - San Markosen Ebanjelioa;Uriarte;1858;19;First Modern Basque;Guipuscoa;Guipuscoan;
(Mark 2,27);The sabbath was made for man, and not man for the sabbath:;Eta gañera esan zien: Larunbata gizonarentzat egin zan, eta ez gizona <larunbatarentzat>.;;rentzat;;BEN;Beneficiary;event;;;Gospel of Mark - San Markosen Ebanjelioa;Uriarte;1858;19;First Modern Basque;Guipuscoa;Guipuscoan;
