verse;English;Basque;gloss;marker;allomorph;case;role;noun-class;remarks_morph;remarks_sem;text;author;year;century;period;place;dialect;
(Kap 81);;P: Zetako bear dira Espiritu Santuen doêak? R: Egin gagiezan obediente aen majestadeak emaiten deuskun pensamentuetarako eta <inspiraziñoetarako>.;;rako;;DEST;Purpose;abstract;;;Exposición breve de la doctrina christiana;Kapanaga;1656;17;Old Basque;Biscay;Biscayan;
(Kap 81);;P: Entendimentuen doêa <zetarako> aprobetxetan jaku? R: Egiak bierretan emaiteko.;;rako;;DEST;Purpose;interrogative;;;Exposición breve de la doctrina christiana;Kapanaga;1656;17;Old Basque;Biscay;Biscayan;
(Kap 81);;P: Entendimentuen doêa zetarako aprobetxetan jaku? R: Egiak bierretan <emaiteko>.;;ko;;REL;Purpose;nominalization;;;Exposición breve de la doctrina christiana;Kapanaga;1656;17;Old Basque;Biscay;Biscayan;
(Kap 81);;Oneekaz ondo <jusgaetako>.;;ko;;REL;Purpose;nominalization;;;Exposición breve de la doctrina christiana;Kapanaga;1656;17;Old Basque;Biscay;Biscayan;
(Kap 93);;Ea juramentu egin deben, pekatu mortala dan gauzaren bat <egiteko>, edo bengeetako bere burua, edo orduan intenziño eukenz kunplietako;;ko;;REL;Purpose;nominalization;;;Exposición breve de la doctrina christiana;Kapanaga;1656;17;Old Basque;Biscay;Biscayan;
(Kap 93);;Ea juramentu egin deben, pekatu mortala dan gauzaren bat egiteko, edo <bengeetako bere burua>, edo orduan intenziño eukenz kunplietako;;ko;;REL;Purpose;nominalization;;;Exposición breve de la doctrina christiana;Kapanaga;1656;17;Old Basque;Biscay;Biscayan;
(Kap 108);;Ea laguneen haziendea deseadu dabeenz <beretako>, deseetan dabela aberats izaitea, bere deseo deungaak kunplietako, edo benganzea artuteko batena, edo desonestidadean bizi izaiteko, edo ez biortuterren, eta ez pagetarren iñori zor deutsana.;;rentako;;BEN;Beneficiary;pronoun;;;Exposición breve de la doctrina christiana;Kapanaga;1656;17;Old Basque;Biscay;Biscayan;
(Kap 108);;Ea laguneen haziendea deseadu dabeenz beretako, deseetan dabela aberats izaitea, <bere deseo deungaak kunplietako>, edo benganzea artuteko batena, edo desonestidadean bizi izaiteko, edo ez biortuterren, eta ez pagetarren iñori zor deutsana.;;ko;;REL;Purpose;nominalization;;;Exposición breve de la doctrina christiana;Kapanaga;1656;17;Old Basque;Biscay;Biscayan;
(Kap 108);;Ea laguneen haziendea deseadu dabeenz beretako, deseetan dabela aberats izaitea, bere deseo deungaak kunplietako, edo <benganzea artuteko> batena, edo desonestidadean bizi izaiteko, edo ez biortuterren, eta ez pagetarren iñori zor deutsana.;;ko;;REL;Purpose;nominalization;;;Exposición breve de la doctrina christiana;Kapanaga;1656;17;Old Basque;Biscay;Biscayan;
(Kap 108);;Ea laguneen haziendea deseadu dabeenz beretako, deseetan dabela aberats izaitea, bere deseo deungaak kunplietako, edo benganzea artuteko batena, edo <desonestidadean bizi izaiteko>, edo ez biortuterren, eta ez pagetarren iñori zor deutsana.;;ko;;REL;Purpose;nominalization;;;Exposición breve de la doctrina christiana;Kapanaga;1656;17;Old Basque;Biscay;Biscayan;
(Kap 110);;Ea deseadu daben lagunari onrea kendu, edo damu izan daben zegati daukan, ibili daen traza eske, <kenduteko> eta desonretako.;;ko;;REL;Purpose;nominalization;;;Exposición breve de la doctrina christiana;Kapanaga;1656;17;Old Basque;Biscay;Biscayan;
(Kap 110);;Ea deseadu daben lagunari onrea kendu, edo damu izan daben zegati daukan, ibili daen traza eske, kenduteko eta <desonretako>.;;ko;;REL;Purpose;nominalization;;;Exposición breve de la doctrina christiana;Kapanaga;1656;17;Old Basque;Biscay;Biscayan;
(Kap 115);;artu eban eriotzea <gu erremedimietako>;;ko;;REL;Purpose;nominalization;;;Exposición breve de la doctrina christiana;Kapanaga;1656;17;Old Basque;Biscay;Biscayan;
(Kap 116);;egin eban zerua <guretako>;;rentako;;BEN;Beneficiary;pronoun;;;Exposición breve de la doctrina christiana;Kapanaga;1656;17;Old Basque;Biscay;Biscayan;
(Kap 118);;Egin bear leukeana ainbat sarrien, edo jagiten danean, edo eziten danean, <alkanzeetako bere pekatuen parkaziñoa>.;;ko;;REL;Purpose;nominalization;;;Exposición breve de la doctrina christiana;Kapanaga;1656;17;Old Basque;Biscay;Biscayan;
(Kap 121);;Irugarrena, edugi begi gogoa firmeza andiagaz, <pekatu mortalegaz egunatan ez ofendietako Jaungoikoa>;;ko;;REL;Purpose;nominalization;;;Exposición breve de la doctrina christiana;Kapanaga;1656;17;Old Basque;Biscay;Biscayan;
(Kap 143);;Gero sazerdoteak, ixilik preparetan dabenean kalizea <ofrezietako>;;ko;;REL;Purpose;nominalization;;;Exposición breve de la doctrina christiana;Kapanaga;1656;17;Old Basque;Biscay;Biscayan;
(Kap 147);;pekatuen parkaziñoa zeinda bear da <komulgetako>, arerioari parkeetea bear dana legez.;;ko;;REL;Purpose;nominalization;;;Exposición breve de la doctrina christiana;Kapanaga;1656;17;Old Basque;Biscay;Biscayan;
(Kap 11);;"sinistu etorriko dala judizioko egunean juzgaetan ilak eta biziak; <onai emaiteko bere gloria>";;ko;;REL;Purpose;nominalization;;;Exposición breve de la doctrina christiana;Kapanaga;1656;17;Old Basque;Biscay;Biscayan;
(Kap 25);;P: Eta guk zegaitik esaten dogu? R: <Fedean konfeseetako>, eta onetan indar geiago euteko.;;ko;;REL;Purpose;nominalization;;;Exposición breve de la doctrina christiana;Kapanaga;1656;17;Old Basque;Biscay;Biscayan;
(Kap 25);;P: Eta guk zegaitik esaten dogu? R: Fedean konfeseetako, eta <onetan indar geiago euteko>.;;ko;;REL;Purpose;nominalization;;;Exposición breve de la doctrina christiana;Kapanaga;1656;17;Old Basque;Biscay;Biscayan;
(Kap 34);;: <Zetarako> ordenadu eban? R: Oraziño egiten irakasteko.;;rako;;DEST;Purpose;interrogative;;;Exposición breve de la doctrina christiana;Kapanaga;1656;17;Old Basque;Biscay;Biscayan;
(Kap 34);;: Zetarako ordenadu eban? R: <Oraziño egiten irakasteko>.;;ko;;REL;Purpose;nominalization;;;Exposición breve de la doctrina christiana;Kapanaga;1656;17;Old Basque;Biscay;Biscayan;
(Kap 41);;P: <Zetarako> dago elexeetan? R: Komute erazaiteko zeruan bizirik dagoana.;;rako;;DEST;Purpose;interrogative;;;Exposición breve de la doctrina christiana;Kapanaga;1656;17;Old Basque;Biscay;Biscayan;
(Kap 41);;P: Zetarako dago elexeetan? R: <Komute erazaiteko zeruan bizirik dagoana>.;;ko;;REL;Purpose;nominalization;;;Exposición breve de la doctrina christiana;Kapanaga;1656;17;Old Basque;Biscay;Biscayan;
(Kap 46);;Zelan bada esango dogu, <ez pekatu egiteko>?;;ko;;REL;Purpose;nominalization;;;Exposición breve de la doctrina christiana;Kapanaga;1656;17;Old Basque;Biscay;Biscayan;
(Kap 55);;P: <Zetarako> dira Elexeen mandamentu santu oneek? R: Obato erakusteko, eta adietan emaiteko Jaungoikoenak.;;rako;;DEST;Purpose;interrogative;;;Exposición breve de la doctrina christiana;Kapanaga;1656;17;Old Basque;Biscay;Biscayan;
(Kap 55);;P: Zetarako dira Elexeen mandamentu santu oneek? R: <Obato erakusteko>, eta adietan emaiteko Jaungoikoenak.;;ko;;REL;Purpose;nominalization;;;Exposición breve de la doctrina christiana;Kapanaga;1656;17;Old Basque;Biscay;Biscayan;
(Kap 55);;P: Zetarako dira Elexeen mandamentu santu oneek? R: Obato erakusteko, eta <adietan emaiteko Jaungoikoenak>.;;ko;;REL;Purpose;nominalization;;;Exposición breve de la doctrina christiana;Kapanaga;1656;17;Old Basque;Biscay;Biscayan;
(Kap 65);;P: <Sakramentu santu au artuteko>, ze disposiziñogaz bear dogu etorri?;;ko;;REL;Purpose;nominalization;;;Exposición breve de la doctrina christiana;Kapanaga;1656;17;Old Basque;Biscay;Biscayan;
(Kap 70);;Eta ze eremedio dago <onetarako>?;;rako;;DEST;Beneficiary;state_of_affairs;;;Exposición breve de la doctrina christiana;Kapanaga;1656;17;Old Basque;Biscay;Biscayan;
(Kap 78);;P: <Norako> bidea emaiten deustee? R: Jaungoikoaganako, eta agaz guztiok bat egiteko.;;rako;;DEST;Purpose;interrogative;;;Exposición breve de la doctrina christiana;Kapanaga;1656;17;Old Basque;Biscay;Biscayan;
(Kap 78);;P: Norako bidea emaiten deustee? R: Jaungoikoaganako, eta <agaz guztiok bat egiteko>.;;ko;;REL;Purpose;nominalization;;;Exposición breve de la doctrina christiana;Kapanaga;1656;17;Old Basque;Biscay;Biscayan;
(Kap 89);;Bada, <egiteko ondo examinau>, eta ekarteko ondo memoriara, bear luke <90> konfesaduko dan baño leenago;;ko;;REL;Purpose;nominalization;;;Exposición breve de la doctrina christiana;Kapanaga;1656;17;Old Basque;Biscay;Biscayan;
(Kap 89);;Bada, egiteko ondo examinau, eta <ekarteko ondo memoriara>, bear luke <90> konfesaduko dan baño leenago;;ko;;REL;Purpose;nominalization;;;Exposición breve de la doctrina christiana;Kapanaga;1656;17;Old Basque;Biscay;Biscayan;
(Kap 105);;Ea bere burua alabadu dabeenz egin eban pekatuagaz, edo besterik alabadu eban, edo mobidu eban <pekatu egiteko>.;;ko;;REL;Purpose;nominalization;;;Exposición breve de la doctrina christiana;Kapanaga;1656;17;Old Basque;Biscay;Biscayan;
(Kap 138);;euna ifini euseena Kristo gure jaunari pasiñoko gabean judeguak <burla egiteko>.;;ko;;REL;Purpose;nominalization;;;Exposición breve de la doctrina christiana;Kapanaga;1656;17;Old Basque;Biscay;Biscayan;
(Kap 147);;Gero esaten dira oraziñoak, <erakusteko> zelan Kristo gure jaunak oraziño egin eban;;ko;;REL;Purpose;nominalization;;;Exposición breve de la doctrina christiana;Kapanaga;1656;17;Old Basque;Biscay;Biscayan;
(Kap 148);;<erakusteko> komulgadu ezkero oraziño egin bear dala;;ko;;REL;Purpose;nominalization;;;Exposición breve de la doctrina christiana;Kapanaga;1656;17;Old Basque;Biscay;Biscayan;
(Kap 148);;<ulerretan emaiteko>, erraz joan deitezala bere bearrera;;ko;;REL;Purpose;nominalization;;;Exposición breve de la doctrina christiana;Kapanaga;1656;17;Old Basque;Biscay;Biscayan;
(Kap 61);;Zetan lagunetan jaku batismua <kristiñauaren bizitzarako>?;;rako;;DEST;Beneficiary;abstract;;;Exposición breve de la doctrina christiana;Kapanaga;1656;17;Old Basque;Biscay;Biscayan;
(Kap 74);;Apetitu eta deseo torpe bat <aragien pekaturako>.;;rako;;DEST;Motive;abstract;;;Exposición breve de la doctrina christiana;Kapanaga;1656;17;Old Basque;Biscay;Biscayan;
(Kap 98);;<onetarako> bear direan beste gauzaak;;rako;;DEST;Purpose;state_of_affairs;;;Exposición breve de la doctrina christiana;Kapanaga;1656;17;Old Basque;Biscay;Biscayan;
(Kap 99);;ukatu deutsan jaatekoa edo soñekoa <bere personarako>, da etserako bear dabena.;;rako;;DEST;Beneficiary;pronoun;;;Exposición breve de la doctrina christiana;Kapanaga;1656;17;Old Basque;Biscay;Biscayan;
(Kap 99);;ukatu deutsan jaatekoa edo soñekoa bere personarako, da <etserako> bear dabena.;;rako;;DEST;Purpose;home;;;Exposición breve de la doctrina christiana;Kapanaga;1656;17;Old Basque;Biscay;Biscayan;
(Kap 104);;<onetarako> konseju emon dabenz.;;rako;;DEST;Purpose;state_of_affairs;;;Exposición breve de la doctrina christiana;Kapanaga;1656;17;Old Basque;Biscay;Biscayan;
(Kap 107);;erremedioen batzuk egin zituzan <intenziño onetarako>.;;rako;;DEST;Purpose;abstract;;;Exposición breve de la doctrina christiana;Kapanaga;1656;17;Old Basque;Biscay;Biscayan;
(Kap 114);;artuten deutsan senarrari diru <etserako> bear eztirean gauzetarako.;;rako;;DEST;Purpose;home;;;Exposición breve de la doctrina christiana;Kapanaga;1656;17;Old Basque;Biscay;Biscayan;
(Kap 114);;artuten deutsan senarrari diru etserako <bear eztirean gauzetarako>.;;rako;;DEST;Purpose;abstract;;;Exposición breve de la doctrina christiana;Kapanaga;1656;17;Old Basque;Biscay;Biscayan;
(Kap 118);;kontu egiten dodala naxala <arako> seme prodigoa;;rako;;DEST;Beneficiary;pronoun;;;Exposición breve de la doctrina christiana;Kapanaga;1656;17;Old Basque;Biscay;Biscayan;
(Kap 119);;Eta ofrezietan ditudaz <neure pekatuen parkaziñorako> neure bizitzea, obraak eta trabajuak.;;rako;;DEST;Purpose;abstract;;;Exposición breve de la doctrina christiana;Kapanaga;1656;17;Old Basque;Biscay;Biscayan;
(Kap 131);;zeinda Kurutzeko altaran izan zinean sakrifizio dignua <mundu guztien redenziñorako>.;;rako;;DEST;Purpose;abstract;;;Exposición breve de la doctrina christiana;Kapanaga;1656;17;Old Basque;Biscay;Biscayan;
(Kap 144);;eskeetan dira errezibidu dagiala Jaungoikoak sakrifizioa, sazerdoteen eskuetarik <bere izen santaen alabanzarako>;;rako;;DEST;Purpose;abstract;;;Exposición breve de la doctrina christiana;Kapanaga;1656;17;Old Basque;Biscay;Biscayan;
(Kap 144);;Elexa Santen (zeinda dira Kristiñau fiel guztiak) <probetxurako>;;rako;;DEST;Purpose;abstract;;;Exposición breve de la doctrina christiana;Kapanaga;1656;17;Old Basque;Biscay;Biscayan;
(Kap 15);;<Arimearen kontrako> arerioak dira iru;;ren_kontra;;postp;Maleficiary;abstract;;;Exposición breve de la doctrina christiana;Kapanaga;1656;17;Old Basque;Biscay;Biscayan;
(Kap 43);;Nok pekatu egiten dau <fedeen kontra>?;;ren_kontra;;postp;Maleficiary;abstract;;;Exposición breve de la doctrina christiana;Kapanaga;1656;17;Old Basque;Biscay;Biscayan;
(Kap 44);;Nok <esperanzeen kontra> pekatu egiten dau?;;ren_kontra;;postp;Maleficiary;abstract;;;Exposición breve de la doctrina christiana;Kapanaga;1656;17;Old Basque;Biscay;Biscayan;
(Kap 44);;Nok <karidaden kontra> pekatu egiten dau?;;ren_kontra;;postp;Maleficiary;abstract;;;Exposición breve de la doctrina christiana;Kapanaga;1656;17;Old Basque;Biscay;Biscayan;
(Kap 47);;Nok bestek pekatu egiten dau <mandamentu onen kontra>?;;ren_kontra;;postp;Maleficiary;abstract;;;Exposición breve de la doctrina christiana;Kapanaga;1656;17;Old Basque;Biscay;Biscayan;
(Kap 49);;Nok <oneen kontra> pekatu egiten dau?;;ren_kontra;;postp;Maleficiary;state_of_affairs;;;Exposición breve de la doctrina christiana;Kapanaga;1656;17;Old Basque;Biscay;Biscayan;
(Kap 70);;<Okasiño gestoen kontra> ze eremedio da?;;ren_kontra;;postp;Maleficiary;event;;;Exposición breve de la doctrina christiana;Kapanaga;1656;17;Old Basque;Biscay;Biscayan;
(Kap 71);;Ze remedio izan al leite <pasiño oneen kontra>?;;ren_kontra;;postp;Maleficiary;emotion;;;Exposición breve de la doctrina christiana;Kapanaga;1656;17;Old Basque;Biscay;Biscayan;
(Kap 72);;egitea <Jaungoikoen kontrako> gauzea.;;ren_kontra;;postp;Maleficiary;God;Agglutination of KO;;Exposición breve de la doctrina christiana;Kapanaga;1656;17;Old Basque;Biscay;Biscayan;
(Kap 92);;Ea <Jaungoikoen kontra> pazienzia galdu dabenz;;ren_kontra;;postp;Maleficiary;God;;;Exposición breve de la doctrina christiana;Kapanaga;1656;17;Old Basque;Biscay;Biscayan;
(Kap 104);;Ea <naturalezako legeen kontra> egin dabeen;;ren_kontra;;postp;Maleficiary;abstract;;;Exposición breve de la doctrina christiana;Kapanaga;1656;17;Old Basque;Biscay;Biscayan;
(Kap 110);;<aen kontra> agertuten dituzala aen linajeko faltaak edo arimakoak;;ren_kontra;;postp;Maleficiary;pronoun;;;Exposición breve de la doctrina christiana;Kapanaga;1656;17;Old Basque;Biscay;Biscayan;
(Kap 111);;Ea edugi dabeenz juizioko gestorik <laguneen onreen kontra>;;ren_kontra;;postp;Maleficiary;abstract;;;Exposición breve de la doctrina christiana;Kapanaga;1656;17;Old Basque;Biscay;Biscayan;
(Kap iv);;uste dabela (dana legez) daroeala dote andi bat <umeendako>;;rentako;rendako;BEN;Beneficiary;people;;;Exposición breve de la doctrina christiana;Kapanaga;1656;17;Old Basque;Biscay;Biscayan;
(Kap 18);;zerren <aendako> da zeruko erreñua.;;rentako;rendako;BEN;Beneficiary;pronoun;;;Exposición breve de la doctrina christiana;Kapanaga;1656;17;Old Basque;Biscay;Biscayan;
(Kap 32);;Irugarrena Purgatorioa, <daukeneendako an zer purgadu>;;rentako;rendako;BEN;Beneficiary;relative;;;Exposición breve de la doctrina christiana;Kapanaga;1656;17;Old Basque;Biscay;Biscayan;
(Kap 32);;Laugarrena egoana <justuendako>,;;rentako;rendako;BEN;Beneficiary;people;;;Exposición breve de la doctrina christiana;Kapanaga;1656;17;Old Basque;Biscay;Biscayan;
(Kap 35);;Zerren anaxe onak legez eskatu gaitezan guztiok <guztiendako>.;;rentako;rendako;BEN;Beneficiary;pronoun;;;Exposición breve de la doctrina christiana;Kapanaga;1656;17;Old Basque;Biscay;Biscayan;
(Kap 87);;probetxu andikoa, alan <eklesiastikoendako>, zeinda sekularendako;;rentako;rendako;BEN;Beneficiary;people;;;Exposición breve de la doctrina christiana;Kapanaga;1656;17;Old Basque;Biscay;Biscayan;
(Kap 87);;probetxu andikoa, alan eklesiastikoendako, zeinda <sekularendako>;;rentako;rendako;BEN;Beneficiary;people;;;Exposición breve de la doctrina christiana;Kapanaga;1656;17;Old Basque;Biscay;Biscayan;
(Kap 147);;Eskeetan da sazerdotea Kristo gure jaunari […] miserikordien, eta bakeen <Elexeendako>.;;rentako;rendako;BEN;Beneficiary;institution;;;Exposición breve de la doctrina christiana;Kapanaga;1656;17;Old Basque;Biscay;Biscayan;
(Kap 66);;Garbietea anz guztiak pekatuenak <inoranziaz>, edo nagitasunez geratu oi jakuzanak.;;z;;INS;Cause;psychologic;;;Exposición breve de la doctrina christiana;Kapanaga;1656;17;Old Basque;Biscay;Biscayan;
(Kap 66);;Garbietea anz guztiak pekatuenak inoranziaz, edo <nagitasunez> geratu oi jakuzanak.;;z;;INS;Force;psychologic;;;Exposición breve de la doctrina christiana;Kapanaga;1656;17;Old Basque;Biscay;Biscayan;
(Kap 71);;Pekatua zeinegaz jaioten garean, dakargula <herenziaz> leelengo gurasoetarean, zeinzuk izan zirean Adan eta Eba.;;z;;INS;Cause;abstract;;;Exposición breve de la doctrina christiana;Kapanaga;1656;17;Old Basque;Biscay;Biscayan;
(Kap 88);;ez zituezan konfesadu <maliziaz> edo lotseagaz;;z;;INS;Cause;psychologic;;;Exposición breve de la doctrina christiana;Kapanaga;1656;17;Old Basque;Biscay;Biscayan;
(Kap 88);;ez zituezan konfesadu maliziaz edo <lotseagaz>;;z;gaz;INS;Force;emotion;;;Exposición breve de la doctrina christiana;Kapanaga;1656;17;Old Basque;Biscay;Biscayan;
(Kap 101);;Ea <laarregi jan eta edanagaz> egin eutsan bere osasunari dañu andirik;;z;gaz;INS;Cause;nominalization;;;Exposición breve de la doctrina christiana;Kapanaga;1656;17;Old Basque;Biscay;Biscayan;
(Kap 114);;<deskuiduz> edo nagiz igaro jakan urtebete eginzaga. ;;z;;INS;Cause;psychologic;;;Exposición breve de la doctrina christiana;Kapanaga;1656;17;Old Basque;Biscay;Biscayan;
(Kap 114);;deskuiduz edo <nagiz> igaro jakan urtebete eginzaga. ;;z;;INS;Force;psychologic;;;Exposición breve de la doctrina christiana;Kapanaga;1656;17;Old Basque;Biscay;Biscayan;
(Kap 115);;Ea bere <deskuiduz> eta dilijenzia gitxi ifiniagatik galdu zan difuntuen aziendea edo fruturik;;z;;INS;Cause;psychologic;;;Exposición breve de la doctrina christiana;Kapanaga;1656;17;Old Basque;Biscay;Biscayan;
(Kap 95);;jai egunetan meza enzun eztaben <bere erruz>;;z;;INS;Cause;abstract;;;Exposición breve de la doctrina christiana;Kapanaga;1656;17;Old Basque;Biscay;Biscayan;
(Kap 99);;alegreetan dala <aen gatxagaz>;;z;gaz;INS;Cause;abstract;;;Exposición breve de la doctrina christiana;Kapanaga;1656;17;Old Basque;Biscay;Biscayan;
(Kap 99);;damurik edugi daben <aen ondasunagaz>;;z;gaz;INS;Cause;abstract;;;Exposición breve de la doctrina christiana;Kapanaga;1656;17;Old Basque;Biscay;Biscayan;
(Kap 105);;etorri ezkero atsegin artu eban <deseo deungeagaz>;;z;gaz;INS;Cause;psychologic;;;Exposición breve de la doctrina christiana;Kapanaga;1656;17;Old Basque;Biscay;Biscayan;
(Kap 105);;Ea bere burua alabadu dabeenz <egin eban pekatuagaz>;;z;gaz;INS;Motive;abstract;;;Exposición breve de la doctrina christiana;Kapanaga;1656;17;Old Basque;Biscay;Biscayan;
(Kap 21);;P: Kristiñaua bazara? R: Bai, <Jesu Kristo geure Jauneen graziagaz>.;;z;gaz;INS;Cause;abstract;;;Exposición breve de la doctrina christiana;Kapanaga;1656;17;Old Basque;Biscay;Biscayan;
(Etx, eskaintza);;Eta <kausa honegatik> gelditzen da abataturik, ezein reputazione bage, eta berze nazione orok uste dute ezin deus ere eskriba daiteiela lengoaje hartan, nola berze orok baitute eskribatzen berian. ;;gatik;;CAUS;Cause;state_of_affairs;;;Linguae Vasconum Primitiae;Etxepare;1545;16;Archaic Basque;Low Navarre;Low_Navarrese;
(Etx I,9);;Muthilek gure zerbitzutan deramate urthia,  <soldata aphur bategatik> hartzen pena handia;;gatik;;CAUS;Motive;money;;;Linguae Vasconum Primitiae;Etxepare;1545;16;Archaic Basque;Low Navarre;Low_Navarrese;
(Etx I,128);;hek <nigatik> ziradela ari nuzu khonduia.;;gatik;;CAUS;Motive;pronoun;;;Linguae Vasconum Primitiae;Etxepare;1545;16;Archaic Basque;Low Navarre;Low_Navarrese;
(Etx I, 225);;hok begira ditzagula, salba giten <hegatik>.;;gatik;;CAUS;Motive;pronoun;;;Linguae Vasconum Primitiae;Etxepare;1545;16;Archaic Basque;Low Navarre;Low_Navarrese;
(Etx I,349);;<zuiegatik> ezarri dut gero neure bizia;;gatik;;CAUS;Motive;pronoun;;;Linguae Vasconum Primitiae;Etxepare;1545;16;Archaic Basque;Low Navarre;Low_Navarrese;
(Etx I,350);;<hoiegatik orogatik> zer da zuien paguia? ;;gatik;;CAUS;Motive;pronoun;;;Linguae Vasconum Primitiae;Etxepare;1545;16;Archaic Basque;Low Navarre;Low_Navarrese;
(Etx II,35);;<berzegatik> hura gabe aro galdu girade. ;;gatik;;CAUS;Cause;state_of_affairs;connector?;;Linguae Vasconum Primitiae;Etxepare;1545;16;Archaic Basque;Low Navarre;Low_Navarrese;
(Etx II,80);;loa galdu, pena aski, bana ez <arimagatik>;;gatik;;CAUS;Motive;spirit;;;Linguae Vasconum Primitiae;Etxepare;1545;16;Archaic Basque;Low Navarre;Low_Navarrese;
(Etx II,81);;orai oro nahi nuke liren <Jeinkoagatik>.;;gatik;;CAUS;Motive;God;;;Linguae Vasconum Primitiae;Etxepare;1545;16;Archaic Basque;Low Navarre;Low_Navarrese;
(Etx II,116);;"Mundu orok eztu egin zuk bezanbat <hargatik>, orogatik bano oboro hark ere daidi zugatik;";;gatik;;CAUS;Cause;connector;;;Linguae Vasconum Primitiae;Etxepare;1545;16;Archaic Basque;Low Navarre;Low_Navarrese;
(Etx II,117);;"Mundu orok eztu egin zuk bezanbat hargatik, <orogatik> bano oboro hark ere daidi zugatik;";;gatik;;CAUS;Motive;pronoun;;;Linguae Vasconum Primitiae;Etxepare;1545;16;Archaic Basque;Low Navarre;Low_Navarrese;
(Etx II,117);;"Mundu orok eztu egin zuk bezanbat hargatik, orogatik bano oboro hark ere daidi <zugatik>;";;gatik;;CAUS;Motive;pronoun;;;Linguae Vasconum Primitiae;Etxepare;1545;16;Archaic Basque;Low Navarre;Low_Navarrese;
(Etx II,134);;samurturik badakutsu <gure gaizkiegatik>, ororen ama zira eta bake gitzazu bertarik. ;;gatik;;CAUS;Cause;abstract;;;Linguae Vasconum Primitiae;Etxepare;1545;16;Archaic Basque;Low Navarre;Low_Navarrese;
(Etx II,136);;Orai egiten diraden <gaizki handiegatik> Jeinkoak ondatu zukeien lur guzia engoitik;;gatik;;CAUS;Cause;abstract;;;Linguae Vasconum Primitiae;Etxepare;1545;16;Archaic Basque;Low Navarre;Low_Navarrese;
(Etx II,138);;balinetan zu ezpazina ararteko <gugatik>;;gatik;;CAUS;Motive;pronoun;;;Linguae Vasconum Primitiae;Etxepare;1545;16;Archaic Basque;Low Navarre;Low_Navarrese;
(Etx II,139);;oro sostengatzen gitu <zure othoiegatik>;;gatik;;CAUS;Means;abstract;;;Linguae Vasconum Primitiae;Etxepare;1545;16;Archaic Basque;Low Navarre;Low_Navarrese;
(Etx III,7);;Zuhur gutik <andregatik> gaizki erran diroite;;gatik;;CAUS;Topic;person;;;Linguae Vasconum Primitiae;Etxepare;1545;16;Archaic Basque;Low Navarre;Low_Navarrese;
(Etx III,9);;Emazteak <zerengatik> gaitz erranen dirate?;;gatik;;CAUS;Cause;pronoun;;;Linguae Vasconum Primitiae;Etxepare;1545;16;Archaic Basque;Low Navarre;Low_Navarrese;
(Etx III,18);;<amagatik> andre oro behar luke goratu;;gatik;;CAUS;Motive;person;;;Linguae Vasconum Primitiae;Etxepare;1545;16;Archaic Basque;Low Navarre;Low_Navarrese;
(Etx IV,2);;bera kaptiba da eta ni gathibu <hargatik>.;;gatik;;CAUS;Cause;connector;;;Linguae Vasconum Primitiae;Etxepare;1545;16;Archaic Basque;Low Navarre;Low_Navarrese;
(Etx VI,23);;Denbora hartan ohi nizin nik <zugatik> dolore;;gatik;;CAUS;Cause;pronoun;;;Linguae Vasconum Primitiae;Etxepare;1545;16;Archaic Basque;Low Navarre;Low_Navarrese;
(Etx VI,30);;jagoitikoz ukhenen dut nik <zugatik> dolore.;;gatik;;CAUS;Motive;pronoun;;;Linguae Vasconum Primitiae;Etxepare;1545;16;Archaic Basque;Low Navarre;Low_Navarrese;
(Etx VII,2);;beti ere behar duta nik <zugatik> dolore?;;gatik;;CAUS;Motive;pronoun;;;Linguae Vasconum Primitiae;Etxepare;1545;16;Archaic Basque;Low Navarre;Low_Navarrese;
(Etx VII,20);;nik <norgatik> pena baitut, hark ene eztu axolik;;gatik;;CAUS;Motive;pronoun;;;Linguae Vasconum Primitiae;Etxepare;1545;16;Archaic Basque;Low Navarre;Low_Navarrese;
(Etx VIII,4);;nik <zugatik> dudan penek hura merexi dute»;;gatik;;CAUS;Motive;pronoun;;;Linguae Vasconum Primitiae;Etxepare;1545;16;Archaic Basque;Low Navarre;Low_Navarrese;
(Etx VIII,12);;<pot bat niri eginagatik>, etzinduke laidorik;;gatik;;CAUS;Cause;nominalization;;;Linguae Vasconum Primitiae;Etxepare;1545;16;Archaic Basque;Low Navarre;Low_Navarrese;
(Etx IX,6);;lotsaturik jarri nuzu, ezpaitakit <zegatik>. ;;gatik;;CAUS;Cause;pronoun;;;Linguae Vasconum Primitiae;Etxepare;1545;16;Archaic Basque;Low Navarre;Low_Navarrese;
(Etx IX,10);;Eztut egin gaizkirik ukheiteko perilik, ezetare <zerengatik> behar dudan auzirik;;gatik;;CAUS;Motive;pronoun;;;Linguae Vasconum Primitiae;Etxepare;1545;16;Archaic Basque;Low Navarre;Low_Navarrese;
(Etx IX,21);;haiek biak galdu ditut, amoria, nik <zugatik>.;;gatik;;CAUS;Cause;pronoun;;;Linguae Vasconum Primitiae;Etxepare;1545;16;Archaic Basque;Low Navarre;Low_Navarrese;
(Etx IX,41);;Ametsetan, agerritan, ni <zugatik> doloretan;;gatik;;CAUS;Cause;pronoun;;;Linguae Vasconum Primitiae;Etxepare;1545;16;Archaic Basque;Low Navarre;Low_Navarrese;
(Etx X,26);;<hargatik> gaitzetsi ezkitzakela;;gatik;;CAUS;Cause;connector;;;Linguae Vasconum Primitiae;Etxepare;1545;16;Archaic Basque;Low Navarre;Low_Navarrese;
(Etx XII,8);;gazte zoroa nizan arren, enukezu <hargatik>.;;gatik;;CAUS;Cause;connector;;;Linguae Vasconum Primitiae;Etxepare;1545;16;Archaic Basque;Low Navarre;Low_Navarrese;
(Etx XII,10);;nik <zugatik> dudan pena, othoi, sendi ezazu;;gatik;;CAUS;Cause;pronoun;;;Linguae Vasconum Primitiae;Etxepare;1545;16;Archaic Basque;Low Navarre;Low_Navarrese;
(Etx XII,12);;ni <zugatik> hil banadi, kargu handi dukezu;;gatik;;CAUS;Cause;pronoun;;;Linguae Vasconum Primitiae;Etxepare;1545;16;Archaic Basque;Low Navarre;Low_Navarrese;
(Etx XII,26);;nik <zugatik> dudan pena hanbat ere handi da;;gatik;;CAUS;Cause;pronoun;;;Linguae Vasconum Primitiae;Etxepare;1545;16;Archaic Basque;Low Navarre;Low_Navarrese;
